"Language","original","english","czech","german","russian","polish","hungarian","italian","spanish","french","chinese","japanese","portuguese","chinesesimp",

"str_iz_hatchbacktrunk0","Lada Niva 4X4 Trunk Door","Lada Niva 4X4 Trunk Door","Dveře od kufru Lada Niva 4X4","Lada Niva 4X4-Hecktür","Дверь багажника Lada Niva 4X4","Klapa bagażnika od Ady 4x4","Lada Niva 4X4 Trunk Door","Portellone posteriore Lada Niva 4X4","Maletero de Lada Niva 4X4","Hayon de Ada 4x4","Lada Niva 4X4 車廂門","Ada 4WD トランクのドア","Lada Niva 4X4 Trunk Door","Lada Niva 4X4 后备箱门",
"str_iz_hatchbacktrunk1","Trunk door of the Lada Niva 4X4 offroad. Used for keeping trunk contents closed.","Trunk door of the Lada Niva 4X4 offroad. Used for keeping trunk contents closed.","Dveře od kufru terénního vozu Lada Niva 4X4. Používá se k uzavření nákladu v kufru.","Hecktür des Lada Niva 4X4-Offroaders. Schützt den Inhalt des Kofferraums.","Дверь багажника внедорожника Lada Niva 4X4. Не дает содержимому багажника выпасть.","Klapa bagażnika od terenówki Lada Niva 4X4. Dzięki niej zawartość bagażnika pozostaje w bagażniku.","Trunk door of the Lada Niva 4X4 offroad. Used for keeping trunk contents closed.","Il portellone posteriore del fuoristrada Lada Niva 4X4. Utilizzato per mantenere al sicuro il contenuto del portabagagli.","Puerta del maletero del todoterreno Lada Niva 4X4. Evita que las cosas se caigan del maletero.","Un hayon pour Ada 4x4. Permet de fermer le coffre et d'en protéger le contenu.","Lada Niva 4X4 越野車的車廂門。鎖住車廂內的物品。","Ada 4WD オフロードのトランクのドア。トランクに入れた物が飛び出さないように使用される。","Trunk door of the Lada Niva 4X4 offroad. Used for keeping trunk contents closed.","Lada Niva 4X4 越野车的后备箱门。用于关住后备箱装的东西。",

"str_iz_hatchbackhood0","Lada Niva 4X4 Hood","Lada Niva 4X4 Hood","Kapota Lada Niva 4X4","Lada Niva 4X4 Motorhaube","Капот Lada Niva 4X4","Maska od Ady 4x4","Lada Niva 4X4 Hood","Cofano Lada Niva 4X4","Capó de Lada Niva 4X4","Capot de Lada Niva 4X4","Lada Niva 4X4 引擎蓋","Ada 4WD ボンネット","Lada Niva 4X4 Hood","Lada Niva 4X4 引擎罩",
"str_iz_hatchbackhood1","Hood of the Lada Niva 4X4 off-road. Helps protect the engine and other sensitive car parts.","Hood of the Lada Niva 4X4 off-road. Helps protect the engine and other sensitive car parts.","Kapota civilního terénního vozu Lada Niva 4X4. Chrání motor a další citlivé součástky auta.","Motorhaube des zivilen Lada Niva 4X4-Offroaders. Schützt den Motor und andere empfindliche Wagenteile.","Капот гражданского внедорожника Lada Niva 4X4. Помогает защитить двигатель и другие важные детали автомобиля.","Maska od terenówki Lada Niva 4X4. Chroni silnik i inne delikatne części samochodu.","Hood of the Lada Niva 4X4 off-road. Helps protect the engine and other sensitive car parts.","Il cofano del fuoristrada per uso civile Lada Niva 4X4. Aiuta a proteggere il motore e altri componenti delicati dell’automobile.","Capó del vehículo civil todoterreno Lada Niva 4X4. Ayuda a proteger el motor y otras partes importantes del coche.","Un capot pour Lada Niva 4X4. Protège le moteur et les pièces essentielles du véhicule.","Lada Niva 4X4 民用越野車的引擎蓋。保護引擎與其他脆弱零件。","Ada 4WD オフロードのボンネット。エンジンやその他の繊細な車のパーツを保護してくれる。","Hood of the Lada Niva 4X4 off-road. Helps protect the engine and other sensitive car parts.","Lada Niva 4X4 民用越野车的引擎盖。可帮助保护发动机和其他敏感的汽车部件。",

"str_iz_hatchbackdoors_driver0","Lada Niva 4X4 Left Door","Lada Niva 4X4 Left Door","Levé dveře Lada Niva 4X4","Lada Niva 4X4-Tür links","Левая дверь Lada Niva 4X4","Lewe drzwi od Ady 4x4","Lada Niva 4X4 Left Door","Portiera sinistra Lada Niva 4X4","Puerta izquierda de Lada Niva 4X4","Portière gauche de Lada Niva 4X4","Lada Niva 4X4 左門","Ada 4WD 左のドア","Lada Niva 4X4 Left Door","Lada Niva 4X4 左门",
"str_iz_hatchbackdoors_driver1","Front left door of the Lada Niva 4X4 off-road. Keeps the driver safe inside the vehicle.","Front left door of the Lada Niva 4X4 off-road. Keeps the driver safe inside the vehicle.","Levé přední dveře terénního vozu Lada Niva 4X4. Chrání řidiče uvnitř vozu.","Linke Vordertür des Lada Niva 4X4-Offroaders. Verhindert, dass der Fahrer aus dem Wagen fällt.","Передняя левая дверь внедорожника Lada Niva 4X4. Обеспечивает безопасность водителя внутри автомобиля.","Przednie lewe drzwi od terenówki Lada Niva 4X4. Dzięki nim kierowca będzie bezpieczny.","Front left door of the Lada Niva 4X4 off-road. Keeps the driver safe inside the vehicle.","La portiera anteriore sinistra del fuoristrada Lada Niva 4X4. Mantiene il pilota al sicuro all’interno del veicolo.","Puerta izquierda delantera del todoterreno Lada Niva 4X4. Mantiene al conductor a salvo dentro del vehículo.","Une portière avant gauche pour Ada 4x4. Permet de protéger le conducteur.","Lada Niva 4X4 越野車的左前門。保持駕駛在車內的安全。","Ada 4WD オフロードの左前のドア。運転席の人も安全に乗れる。","Front left door of the Lada Niva 4X4 off-road. Keeps the driver safe inside the vehicle.","Lada Niva 4X4 越野车的左前车门。确保车内驾驶员的安全。",

"str_iz_hatchbackdoors_codriver0","Lada Niva 4X4 Right Door","Lada Niva 4X4 Right Door","Pravé dveře Lada Niva 4X4","Lada Niva 4X4-Tür rechts","Правая дверь Lada Niva 4X4","Prawe drzwi od Ady 4x4","Lada Niva 4X4 Right Door","Portiera destra Lada Niva 4X4","Puerta derecha de Lada Niva 4X4","Portière droite de Lada Niva 4X4","Lada Niva 4X4 右門","Ada 4WD 右のドア","Lada Niva 4X4 Right Door","Lada Niva 4X4 右门",
"str_iz_hatchbackdoors_codriver1","Front right door of the Lada Niva 4X4 off-road. Keeps the co-driver safe inside the vehicle.","Front right door of the Lada Niva 4X4 off-road. Keeps the co-driver safe inside the vehicle.","Pravé přední dveře terénního vozu Lada Niva 4X4. Chrání spolujezdce vepředu.","Rechte Vordertür des Lada Niva 4X4-Offroaders. Verhindert, dass der Beifahrer aus dem Wagen fällt.","Передняя правая дверь внедорожника Lada Niva 4X4. Обеспечивает безопасность сменного водителя внутри автомобиля.","Przednie prawe drzwi od terenówki Lada Niva 4X4. Dzięki nim drugi kierowca będzie bezpieczny.","Front right door of the Lada Niva 4X4 off-road. Keeps the co-driver safe inside the vehicle.","La portiera anteriore destra del fuoristrada Lada Niva 4X4. Mantiene il copilota al sicuro all’interno del veicolo.","Puerta derecha delantera del vehículo todoterreno Lada Niva 4X4. Mantiene al copiloto a salvo dentro del vehículo.","Une portière avant droite pour Ada 4x4. Permet de protéger le passager avant.","Lada Niva 4X4 越野車的右前門。保持副駕駛在車內的安全。","Ada 4WD オフロードの右前のドア。助手席の人も安全に乗れる。","Front right door of the Lada Niva 4X4 off-road. Keeps the co-driver safe inside the vehicle.","Lada Niva 4X4 越野车的右前车门。确保车内副驾驶员的安全。",

"str_iz_civsedantrunk0","GAZ-24 „Volga“ Trunk Lid","GAZ-24 „Volga“ Trunk Lid","Dveře od kufru GAZ-24 „Volga“","GAZ-24 „Volga“-Kofferraumklappe","Крышка багажника GAZ-24 „Volga“","Klapa bagażnika od Olgi 24","GAZ-24 „Volga“ Trunk Lid","Cofano posteriore GAZ-24 „Volga“","Maletero de GAZ-24 „Volga“","Coffre de Olga 24","GAZ-24 „Volga“ 車廂蓋","GAZ-24 „Volga“ トランクリッド","GAZ-24 „Volga“ Trunk Lid","GAZ-24 „Volga“ 后备箱盖",
"str_iz_civsedantrunk1","Trunk lid of the GAZ-24 „Volga“ sedan. Used for keeping trunk contents closed.","Trunk lid of the GAZ-24 „Volga“ sedan. Used for keeping trunk contents closed.","Dveře od kufru sedanu GAZ-24 „Volga“. Používá se k uzavření nákladu v kufru.","Kofferraumklappe der GAZ-24 „Volga“-Limousine. Schützt den Inhalt des Kofferraums.","Крышка багажника седана GAZ-24 „Volga“. Не дает содержимому багажника выпасть.","Klapa bagażnika od sedana GAZ-24 „Volga“. Dzięki niej zawartość bagażnika pozostaje w bagażniku.","Trunk lid of the GAZ-24 „Volga“ sedan. Used for keeping trunk contents closed.","Il cofano posteriore della berlina GAZ-24 „Volga“. Utilizzato per mantenere al sicuro il contenuto del portabagagli.","Puerta del maletero de la berlina GAZ-24 „Volga“. Se usa para guardar el contenido del maletero.","Un coffre pour berline Olga 24. Permet de fermer le coffre et d'en protéger le contenu.","GAZ-24 „Volga“ 四門客車的車廂蓋。鎖住車廂內的物品。","GAZ-24 „Volga“ セダンのトランクリッド。トランクに入れた物が飛び出さないように使用される。","Trunk lid of the GAZ-24 „Volga“ sedan. Used for keeping trunk contents closed.","GAZ-24 „Volga“ 轿车的后备箱盖。用于关住后备箱装的东西。",

"str_iz_civsedanhood0","GAZ-24 „Volga“ Hood","GAZ-24 „Volga“ Hood","Kapota GAZ-24 „Volga“","GAZ-24 „Volga“ Motorhaube","Капот GAZ-24 „Volga“","Maska od Olgi 24","GAZ-24 „Volga“ Hood","Cofano GAZ-24 „Volga“","Capó de GAZ-24 „Volga“","Capot de Olga 24","GAZ-24 „Volga“ 引擎蓋","GAZ-24 „Volga“ ボンネット","GAZ-24 „Volga“ Hood","GAZ-24 „Volga“ 引擎盖",
"str_iz_civsedanhood1","Hood of the GAZ-24 „Volga“ sedan. Helps protect the engine and other sensitive car parts.","Hood of the GAZ-24 „Volga“ sedan. Helps protect the engine and other sensitive car parts.","Kapota sedanu GAZ-24 „Volga“. Chrání motor a další citlivé součástky auta.","Motorhaube der GAZ-24 „Volga“-Limousine. Schützt den Motor und andere empfindliche Wagenteile.","Капот седана GAZ-24 „Volga“. Помогает защитить двигатель и другие важные детали автомобиля.","Maska od sedana GAZ-24 „Volga“. Chroni silnik i inne delikatne części samochodu.","Hood of the GAZ-24 „Volga“ sedan. Helps protect the engine and other sensitive car parts.","Il cofano della berlina GAZ-24 „Volga“. Aiuta a proteggere il motore e altri componenti delicati dell’automobile.","Capó de la berlina GAZ-24 „Volga“. Ayuda a proteger el motor y otras partes importantes del coche.","Un capot pour berline Olga 24. Protège le moteur et les pièces essentielles du véhicule.","GAZ-24 „Volga“ 四門課車的引擎蓋。保護引擎與其他脆弱零件。","GAZ-24 „Volga“ セダンのボンネット。エンジンやその他の繊細な車のパーツを保護してくれる。","Hood of the GAZ-24 „Volga“ sedan. Helps protect the engine and other sensitive car parts.","GAZ-24 „Volga“ 轿车的引擎盖。可帮助保护发动机和其他敏感的汽车部件。",

"str_iz_civsedandoors_driver0","GAZ-24 „Volga“ Front Left Door","GAZ-24 „Volga“ Front Left Door","Levé přední dveře GAZ-24 „Volga“","GAZ-24 „Volga“ Tür vorne links","Передняя левая дверь GAZ-24 „Volga“","Przednie lewe drzwi od Olgi 24","GAZ-24 „Volga“ Front Left Door","Portiera anteriore sinistra GAZ-24 „Volga“","Puerta izquierda delantera de GAZ-24 „Volga“","Portière AVG de Olga 24","GAZ-24 „Volga“ 左前門","GAZ-24 „Volga“ 左前のドア","GAZ-24 „Volga“ Front Left Door","GAZ-24 „Volga“ 左前车门",
"str_iz_civsedandoors_driver1","Front left door of the GAZ-24 „Volga“ sedan. Keeps the driver safe inside the vehicle.","Front left door of the GAZ-24 „Volga“ sedan. Keeps the driver safe inside the vehicle.","Levé přední dveře sedanu GAZ-24 „Volga“. Chrání řidiče uvnitř vozu.","Linke Vordertür der GAZ-24 „Volga“-Limousine. Verhindert, dass der Fahrer aus dem Wagen fällt.","Передняя левая дверь седана GAZ-24 „Volga“. Обеспечивает безопасность водителя внутри автомобиля.","Przednie lewe drzwi od sedana GAZ-24 „Volga“. Dzięki nim kierowca będzie bezpieczny.","Front left door of the GAZ-24 „Volga“ sedan. Keeps the driver safe inside the vehicle.","La portiera anteriore sinistra della berlina GAZ-24 „Volga“. Mantiene il pilota al sicuro all’interno del veicolo.","Puerta izquierda delantera de la berlina GAZ-24 „Volga“. Mantiene al conductor a salvo dentro del vehículo.","Une portière avant gauche pour berline Olga 24. Permet de protéger le conducteur.","GAZ-24 „Volga“ 四門客車的左前門。保持駕駛在車內的安全。","GAZ-24 „Volga“ セダンの左前のドア。運転席の人も安全に乗れる。","Front left door of the GAZ-24 „Volga“ sedan. Keeps the driver safe inside the vehicle.","GAZ-24 „Volga“ 轿车左前车门。确保车内驾驶员的安全。",

"str_iz_civsedandoors_codriver0","GAZ-24 „Volga“ Front Right Door","GAZ-24 „Volga“ Front Right Door","Pravé přední dveře GAZ-24 „Volga“","GAZ-24 „Volga“ Tür vorne rechts","Передняя правая дверь GAZ-24 „Volga“","Przednie prawe drzwi od Olgi 24","GAZ-24 „Volga“ Front Right Door","Portiera anteriore destra GAZ-24 „Volga“","Puerta derecha delantera de GAZ-24 „Volga“","Portière AVD de Olga 24","GAZ-24 „Volga“ 右前門","GAZ-24 „Volga“ 右前のドア","GAZ-24 „Volga“ Front Right Door","GAZ-24 „Volga“ 右前车门",
"str_iz_civsedandoors_codriver1","Front right door of the GAZ-24 „Volga“ sedan. Keeps the co-driver safe inside the vehicle.","Front right door of the GAZ-24 „Volga“ sedan. Keeps the co-driver safe inside the vehicle.","Pravé přední dveře sedanu GAZ-24 „Volga“. Chrání spolujezdce vepředu.","Rechte Vordertür der GAZ-24 „Volga“-Limousine. Verhindert, dass der Beifahrer aus dem Wagen fällt.","Передняя правая дверь седана GAZ-24 „Volga“. Обеспечивает безопасность сменного водителя внутри автомобиля.","Przednie prawe drzwi od sedana GAZ-24 „Volga“. Dzięki nim drugi kierowca będzie bezpieczny.","Front right door of the GAZ-24 „Volga“ sedan. Keeps the co-driver safe inside the vehicle.","La portiera anteriore destra della berlina GAZ-24 „Volga“. Mantiene il copilota al sicuro all’interno del veicolo.","Puerta derecha delantera de la berlina GAZ-24 „Volga“. Mantiene al copiloto a salvo dentro del vehículo.","Une portière avant droite pour berline Olga 24. Permet de protéger le passager avant.","GAZ-24 „Volga“ 四門客車的右前門。保持副駕駛在車內的安全。","GAZ-24 „Volga“ セダンの右前のドア。助手席の人も安全に乗れる。","Front right door of the GAZ-24 „Volga“ sedan. Keeps the co-driver safe inside the vehicle.","GAZ-24 „Volga“ 轿车右前车门。确保车内副驾驶员的安全。",

"str_iz_civsedandoors_backright0","GAZ-24 „Volga“ Rear Right Door","GAZ-24 „Volga“ Rear Right Door","Pravé zadní dveře GAZ-24 „Volga“","GAZ-24 „Volga“ Tür hinten rechts","Задняя правая дверь GAZ-24 „Volga“","Tyle prawe drzwi od Olgi 24","GAZ-24 „Volga“ Rear Right Door","Portiera posteriore destra GAZ-24 „Volga“","Puerta derecha trasera de GAZ-24 „Volga“","Portière ARD de Olga 24","GAZ-24 „Volga“ 右後門","GAZ-24 „Volga“ 右後ろのドア","GAZ-24 „Volga“ Rear Right Door","GAZ-24 „Volga“ 右后车门",
"str_iz_civsedandoors_backright1","Rear right door of the GAZ-24 „Volga“ sedan. Keeps the passenger in the backseat safe inside the vehicle.","Rear right door of the GAZ-24 „Volga“ sedan. Keeps the passenger in the backseat safe inside the vehicle.","Pravé zadní dveře sedanu GAZ-24 „Volga“. Chrání spolujezdce na zadním sedadle uvnitř vozu.","Rechte Hintertür der GAZ-24 „Volga“-Limousine. Verhindert, dass Passagiere auf der Rückbank aus dem Wagen fallen.","Задняя правая дверь седана GAZ-24 „Volga“. Обеспечивает безопасность пассажиров на заднем сиденье.","Tylne prawe drzwi od sedana GAZ-24 „Volga“. Dzięki nim pasażer z tyłu będzie bezpieczny.","Rear right door of the GAZ-24 „Volga“ sedan. Keeps the passenger in the backseat safe inside the vehicle.","La portiera posteriore destra della berlina GAZ-24 „Volga“. Mantiene il passeggero seduto sul sedile posteriore al sicuro all’interno del veicolo.","Puerta derecha trasera de la berlina GAZ-24 „Volga“. Mantiene a los pasajeros del asiento de atrás a salvo dentro del vehículo.","Une portière arrière droite pour berline Olga 24. Permet de protéger le passager arrière à droite.","GAZ-24 „Volga“ 四門客車的右後門。使後座乘客安全的坐在車內。","GAZ-24 „Volga“ セダンの右後ろのドア。後部席の人も安全に乗れる。","Rear right door of the GAZ-24 „Volga“ sedan. Keeps the passenger in the backseat safe inside the vehicle.","GAZ-24 „Volga“ 轿车右后车门。确保车内后座乘客的安全。",

"str_iz_civsedandoors_backleft0","GAZ-24 „Volga“ Rear Left Door","GAZ-24 „Volga“ Rear Left Door","Levé zadní dveře GAZ-24 „Volga“","GAZ-24 „Volga“ Tür hinten links","Задняя левая дверь GAZ-24 „Volga“","Tyle lewe drzwi od Olgi 24","GAZ-24 „Volga“ Rear Left Door","Portiera posteriore sinistra GAZ-24 „Volga“","Puerta izquierda trasera de GAZ-24 „Volga“","Portière ARG de Olga 24","GAZ-24 „Volga“ 左後門","GAZ-24 „Volga“ 左後ろのドア","GAZ-24 „Volga“ Rear Left Door","GAZ-24 „Volga“ 左后车门",
"str_iz_civsedandoors_backleft1","Rear left door of the GAZ-24 „Volga“ sedan. Keeps the passenger in the backseat safe inside the vehicle.","Rear left door of the GAZ-24 „Volga“ sedan. Keeps the passenger in the backseat safe inside the vehicle.","Levé zadní dveře sedanu GAZ-24 „Volga“. Chrání spolujezdce na zadním sedadle uvnitř vozu.","Linke Hintertür der GAZ-24 „Volga“-Limousine. Verhindert, dass Passagiere auf der Rückbank aus dem Wagen fallen.","Задняя левая дверь седана GAZ-24 „Volga“. Обеспечивает безопасность пассажиров на заднем сиденье.","Tylne lewe drzwi od sedana GAZ-24 „Volga“. Dzięki nim pasażer z tyłu będzie bezpieczny.","Rear left door of the GAZ-24 „Volga“ sedan. Keeps the passenger in the backseat safe inside the vehicle.","La portiera posteriore sinistra della berlina GAZ-24 „Volga“. Mantiene il passeggero seduto sul sedile posteriore al sicuro all’interno del veicolo.","Puerta izquierda trasera de la berlina GAZ-24 „Volga“. Mantiene a los pasajeros del asiento de atrás a salvo dentro del vehículo.","Une portière arrière gauche pour berline Olga 24. Permet de protéger le passager arrière à gauche.","GAZ-24 „Volga“ 四門客車的左後門。使後座乘客安全的坐在車內。","GAZ-24 „Volga“ セダンの左後ろのドア。後部席の人も安全に乗れる。","Rear left door of the GAZ-24 „Volga“ sedan. Keeps the passenger in the backseat safe inside the vehicle.","GAZ-24 „Volga“ 轿车左后车门。确保车内后座乘客的安全。",

"str_iz_civhatchbackdoors_codriver0","VW Golf II Front Right Door","VW Golf II Front Right Door","Pravé přední dveře VW Golf II","VW Golf II Tür vorne rechts","Передняя правая дверь VW Golf II","Przednie prawe drzwi od Guntera 2","VW Golf II Front Right Door","Portiera anteriore destra VW Golf II","Puerta derecha delantera de VW Golf II","Portière AVD de Gunter 2","VW Golf II 右前門","VW Golf II 右前のドア","VW Golf II Front Right Door","VW Golf II 右前车门",
"str_iz_civhatchbackdoors_codriver1","Front right door of the VW Golf II hatchback. Keeps co-driver safe inside vehicle.","Front right door of the VW Golf II hatchback. Keeps co-driver safe inside vehicle.","Pravé přední dveře hatchbacku Gunter 2. Zajišťují bezpečnost spolujezdce uvnitř auta.","Rechte Vordertür der VW Golf II-Kombilimousine. Verhindert, dass der Beifahrer aus dem Wagen fällt.","Передняя правая дверь хэтчбека VW Golf II. Обеспечивает безопасность сменного водителя внутри автомобиля.","Przednie prawe drzwi od hatchbacka VW Golf II. Dzięki nim drugi kierowca będzie bezpieczny.","Front right door of the VW Golf II hatchback. Keeps co-driver safe inside vehicle.","La portiera anteriore destra della due volumi VW Golf II. Mantiene il co-pilota al sicuro all’interno del veicolo.","Puerta derecha delantera del VW Golf II. Mantiene al copiloto a salvo dentro del vehículo.","Une portière avant droite pour la berline à hayon Gunter 2. Permet de protéger le passager avant.","VW Golf II 掀背車的右前門。保持副駕駛在車內的安全。","VW Golf II ハッチバックの右前のドア。助手席の人も安全に乗れる。","Front right door of the VW Golf II hatchback. Keeps co-driver safe inside vehicle.","VW Golf II 掀背车的右前车门。可确保车内副驾驶员的安全。",

"str_iz_civhatchbackdoors_driver0","VW Golf II Front Left Door","VW Golf II Front Left Door","Levé přední dveře VW Golf II","VW Golf II Tür vorne links","Передняя левая дверь VW Golf II","Przednie lewe drzwi od Guntera 2","VW Golf II Front Left Door","Portiera anteriore sinistra VW Golf II","Puerta izquierda delantera de VW Golf II","Portière AVG de Gunter 2","VW Golf II 左前門","VW Golf II 左前のドア","VW Golf II Front Left Door","VW Golf II 左前车门",
"str_iz_civhatchbackdoors_driver1","Front left door of the VW Golf II hatchback. Keeps driver safe inside vehicle.","Front left door of the VW Golf II hatchback. Keeps driver safe inside vehicle.","Levé přední dveře hatchbacku Gunter 2. Zajišťují bezpečnost řidiče uvnitř auta.","Linke Vordertür der VW Golf II-Kombilimousine. Verhindert, dass der Fahrer aus dem Wagen fällt.","Передняя левая дверь хэтчбека VW Golf II. Обеспечивает безопасность водителя внутри автомобиля.","Przednie lewe drzwi od hatchbacka VW Golf II. Dzięki nim kierowca będzie bezpieczny.","Front left door of the VW Golf II hatchback. Keeps driver safe inside vehicle.","La portiera anteriore sinistra della due volumi VW Golf II. Mantiene il pilota al sicuro all’interno del veicolo.","Puerta izquierda delantera del VW Golf II. Mantiene al piloto a salvo dentro del vehículo.","Une portière avant gauche pour la berline à hayon Gunter 2. Permet de protéger le conducteur.","VW Golf II 掀背車的左前門。保持駕駛在車內的安全。","VW Golf II ハッチバックの左前のドア。運転席の人も安全に乗れる。","Front left door of the VW Golf II hatchback. Keeps driver safe inside vehicle.","VW Golf II 掀背车的左前车门。可确保车内驾驶员的安全。",

"str_iz_civhatchbackdoors_hood0","VW Golf II Hood","VW Golf II Hood","Kapota Gunter 2","VW Golf II Motorhaube","Капот VW Golf II","Maska od Guntera 2","VW Golf II Hood","Cofano VW Golf II","Capó de VW Golf II","Capot de Gunter 2","VW Golf II 引擎蓋","VW Golf II ボンネット","VW Golf II Hood","VW Golf II 引擎盖",
"str_iz_civhatchbackdoors_hood1","Hood of the VW Golf II hatchback. Helps protect the engine and other sensitive car parts.","Hood of the VW Golf II hatchback. Helps protect the engine and other sensitive car parts.","Kapota hatchbacku Gunter 2. Chrání motor a další citlivé součásti auta.","Motorhaube der VW Golf II-Kombilimousine. Schützt den Motor und andere empfindliche Wagenteile.","Капот хэтчбека VW Golf II. Помогает защитить двигатель и другие важные детали автомобиля.","Maska od hatchbacka VW Golf II. Chroni silnik i inne delikatne części samochodu.","Hood of the VW Golf II hatchback. Helps protect the engine and other sensitive car parts.","Il cofano della due volumi VW Golf II. Aiuta a proteggere il motore e altri componenti delicati dell’automobile.","Capó de VW Golf II. Ayuda a proteger el motor y otras partes importantes del coche.","Un capot pour la berline à hayon Gunter 2. Protège le moteur et les pièces essentielles du véhicule.","VW Golf II 掀背車的引擎蓋。保護引擎與其他脆弱零件。","VW Golf II ハッチバックのボンネット。エンジンやその他の繊細な車のパーツを保護してくれる。","Hood of the VW Golf II hatchback. Helps protect the engine and other sensitive car parts.","VW Golf II 掀背车的引擎盖。可帮助保护发动机和其他易损汽车部件。",

